[
  {
    "id": 1,
    "patient_id": 1,
    "provider": "Lakeview Assurance",
    "policy_number": "POL-00000001",
    "coverage_level": "Basic",
    "annual_premium": 1501.97,
    "valid_from": "2023-10-31",
    "valid_until": "2026-10-31"
  },
  {
    "id": 2,
    "patient_id": 2,
    "provider": "Stonebridge Health",
    "policy_number": "POL-00000002",
    "coverage_level": "Basic",
    "annual_premium": 1106.46,
    "valid_from": "2024-09-13",
    "valid_until": "2025-09-13"
  },
  {
    "id": 3,
    "patient_id": 3,
    "provider": "Pinefield Medical",
    "policy_number": "POL-00000003",
    "coverage_level": "Standard",
    "annual_premium": 2251.88,
    "valid_from": "2023-09-01",
    "valid_until": "2025-09-01"
  },
  {
    "id": 4,
    "patient_id": 4,
    "provider": "Lakeview Assurance",
    "policy_number": "POL-00000004",
    "coverage_level": "Premium",
    "annual_premium": 5090.68,
    "valid_from": "2023-06-30",
    "valid_until": "2024-06-30"
  },
  {
    "id": 5,
    "patient_id": 6,
    "provider": "Meridian Mutual",
    "policy_number": "POL-00000005",
    "coverage_level": "Basic",
    "annual_premium": 1123.4,
    "valid_from": "2023-01-02",
    "valid_until": "2024-01-02"
  },
  {
    "id": 6,
    "patient_id": 7,
    "provider": "Stonebridge Health",
    "policy_number": "POL-00000006",
    "coverage_level": "Standard",
    "annual_premium": 2205.32,
    "valid_from": "2023-01-08",
    "valid_until": "2024-01-08"
  },
  {
    "id": 7,
    "patient_id": 8,
    "provider": "Caldera Care",
    "policy_number": "POL-00000007",
    "coverage_level": "Standard",
    "annual_premium": 3499.6,
    "valid_from": "2024-06-13",
    "valid_until": "2027-06-13"
  },
  {
    "id": 8,
    "patient_id": 9,
    "provider": "Northwind Health",
    "policy_number": "POL-00000008",
    "coverage_level": "Basic",
    "annual_premium": 1204.55,
    "valid_from": "2024-01-06",
    "valid_until": "2026-01-06"
  },
  {
    "id": 9,
    "patient_id": 10,
    "provider": "Meridian Mutual",
    "policy_number": "POL-00000009",
    "coverage_level": "Standard",
    "annual_premium": 2851.7,
    "valid_from": "2023-03-02",
    "valid_until": "2025-03-02"
  },
  {
    "id": 10,
    "patient_id": 11,
    "provider": "Caldera Care",
    "policy_number": "POL-00000010",
    "coverage_level": "Basic",
    "annual_premium": 1044.3,
    "valid_from": "2023-06-01",
    "valid_until": "2024-06-01"
  },
  {
    "id": 11,
    "patient_id": 12,
    "provider": "Blue Harbour Cover",
    "policy_number": "POL-00000011",
    "coverage_level": "Premium",
    "annual_premium": 4373.82,
    "valid_from": "2023-06-26",
    "valid_until": "2026-06-26"
  },
  {
    "id": 12,
    "patient_id": 14,
    "provider": "Blue Harbour Cover",
    "policy_number": "POL-00000012",
    "coverage_level": "Basic",
    "annual_premium": 1119.59,
    "valid_from": "2023-08-30",
    "valid_until": "2026-08-30"
  },
  {
    "id": 13,
    "patient_id": 16,
    "provider": "Stonebridge Health",
    "policy_number": "POL-00000013",
    "coverage_level": "Premium",
    "annual_premium": 4012.03,
    "valid_from": "2023-04-01",
    "valid_until": "2026-04-01"
  },
  {
    "id": 14,
    "patient_id": 17,
    "provider": "Meridian Mutual",
    "policy_number": "POL-00000014",
    "coverage_level": "Basic",
    "annual_premium": 1183.78,
    "valid_from": "2024-11-09",
    "valid_until": "2026-11-09"
  },
  {
    "id": 15,
    "patient_id": 18,
    "provider": "Stonebridge Health",
    "policy_number": "POL-00000015",
    "coverage_level": "Standard",
    "annual_premium": 3144.28,
    "valid_from": "2024-07-15",
    "valid_until": "2025-07-15"
  },
  {
    "id": 16,
    "patient_id": 19,
    "provider": "Caldera Care",
    "policy_number": "POL-00000016",
    "coverage_level": "Standard",
    "annual_premium": 3490.99,
    "valid_from": "2023-08-06",
    "valid_until": "2026-08-06"
  },
  {
    "id": 17,
    "patient_id": 20,
    "provider": "Meridian Mutual",
    "policy_number": "POL-00000017",
    "coverage_level": "Basic",
    "annual_premium": 1234.86,
    "valid_from": "2023-04-02",
    "valid_until": "2026-04-02"
  },
  {
    "id": 18,
    "patient_id": 21,
    "provider": "Meridian Mutual",
    "policy_number": "POL-00000018",
    "coverage_level": "Basic",
    "annual_premium": 1409.67,
    "valid_from": "2024-03-21",
    "valid_until": "2026-03-21"
  },
  {
    "id": 19,
    "patient_id": 22,
    "provider": "Pinefield Medical",
    "policy_number": "POL-00000019",
    "coverage_level": "Standard",
    "annual_premium": 2684.01,
    "valid_from": "2024-01-09",
    "valid_until": "2027-01-09"
  },
  {
    "id": 20,
    "patient_id": 23,
    "provider": "Stonebridge Health",
    "policy_number": "POL-00000020",
    "coverage_level": "Standard",
    "annual_premium": 2255.63,
    "valid_from": "2024-09-10",
    "valid_until": "2025-09-10"
  },
  {
    "id": 21,
    "patient_id": 24,
    "provider": "Caldera Care",
    "policy_number": "POL-00000021",
    "coverage_level": "Premium",
    "annual_premium": 3456.56,
    "valid_from": "2023-01-16",
    "valid_until": "2025-01-16"
  },
  {
    "id": 22,
    "patient_id": 25,
    "provider": "Lakeview Assurance",
    "policy_number": "POL-00000022",
    "coverage_level": "Basic",
    "annual_premium": 1639.6,
    "valid_from": "2023-04-05",
    "valid_until": "2026-04-05"
  },
  {
    "id": 23,
    "patient_id": 26,
    "provider": "Caldera Care",
    "policy_number": "POL-00000023",
    "coverage_level": "Standard",
    "annual_premium": 2351.22,
    "valid_from": "2023-10-31",
    "valid_until": "2024-10-31"
  },
  {
    "id": 24,
    "patient_id": 27,
    "provider": "Lakeview Assurance",
    "policy_number": "POL-00000024",
    "coverage_level": "Standard",
    "annual_premium": 2714.46,
    "valid_from": "2024-07-10",
    "valid_until": "2027-07-10"
  },
  {
    "id": 25,
    "patient_id": 28,
    "provider": "Caldera Care",
    "policy_number": "POL-00000025",
    "coverage_level": "Basic",
    "annual_premium": 1083.76,
    "valid_from": "2024-05-10",
    "valid_until": "2026-05-10"
  },
  {
    "id": 26,
    "patient_id": 29,
    "provider": "Meridian Mutual",
    "policy_number": "POL-00000026",
    "coverage_level": "Comprehensive",
    "annual_premium": 5678.28,
    "valid_from": "2023-07-15",
    "valid_until": "2025-07-15"
  },
  {
    "id": 27,
    "patient_id": 30,
    "provider": "Meridian Mutual",
    "policy_number": "POL-00000027",
    "coverage_level": "Premium",
    "annual_premium": 5893.61,
    "valid_from": "2023-09-07",
    "valid_until": "2025-09-07"
  },
  {
    "id": 28,
    "patient_id": 31,
    "provider": "Pinefield Medical",
    "policy_number": "POL-00000028",
    "coverage_level": "Basic",
    "annual_premium": 1115.23,
    "valid_from": "2023-12-15",
    "valid_until": "2024-12-15"
  },
  {
    "id": 29,
    "patient_id": 32,
    "provider": "Pinefield Medical",
    "policy_number": "POL-00000029",
    "coverage_level": "Standard",
    "annual_premium": 2003.43,
    "valid_from": "2023-02-09",
    "valid_until": "2026-02-09"
  },
  {
    "id": 30,
    "patient_id": 33,
    "provider": "Northwind Health",
    "policy_number": "POL-00000030",
    "coverage_level": "Premium",
    "annual_premium": 3638.58,
    "valid_from": "2023-02-26",
    "valid_until": "2025-02-26"
  },
  {
    "id": 31,
    "patient_id": 34,
    "provider": "Stonebridge Health",
    "policy_number": "POL-00000031",
    "coverage_level": "Standard",
    "annual_premium": 2296.93,
    "valid_from": "2024-08-06",
    "valid_until": "2025-08-06"
  },
  {
    "id": 32,
    "patient_id": 35,
    "provider": "Stonebridge Health",
    "policy_number": "POL-00000032",
    "coverage_level": "Standard",
    "annual_premium": 2182.98,
    "valid_from": "2024-08-17",
    "valid_until": "2026-08-17"
  },
  {
    "id": 33,
    "patient_id": 36,
    "provider": "Arcadia Health Plan",
    "policy_number": "POL-00000033",
    "coverage_level": "Basic",
    "annual_premium": 1060.04,
    "valid_from": "2024-01-09",
    "valid_until": "2027-01-09"
  },
  {
    "id": 34,
    "patient_id": 37,
    "provider": "Pinefield Medical",
    "policy_number": "POL-00000034",
    "coverage_level": "Premium",
    "annual_premium": 4642.86,
    "valid_from": "2023-12-15",
    "valid_until": "2026-12-15"
  },
  {
    "id": 35,
    "patient_id": 38,
    "provider": "Blue Harbour Cover",
    "policy_number": "POL-00000035",
    "coverage_level": "Basic",
    "annual_premium": 1031.84,
    "valid_from": "2024-08-03",
    "valid_until": "2026-08-03"
  },
  {
    "id": 36,
    "patient_id": 39,
    "provider": "Northwind Health",
    "policy_number": "POL-00000036",
    "coverage_level": "Basic",
    "annual_premium": 1045.98,
    "valid_from": "2024-05-07",
    "valid_until": "2025-05-07"
  },
  {
    "id": 37,
    "patient_id": 40,
    "provider": "Stonebridge Health",
    "policy_number": "POL-00000037",
    "coverage_level": "Premium",
    "annual_premium": 3489.6,
    "valid_from": "2024-07-14",
    "valid_until": "2027-07-14"
  },
  {
    "id": 38,
    "patient_id": 41,
    "provider": "Northwind Health",
    "policy_number": "POL-00000038",
    "coverage_level": "Basic",
    "annual_premium": 1104.73,
    "valid_from": "2023-07-06",
    "valid_until": "2025-07-06"
  },
  {
    "id": 39,
    "patient_id": 42,
    "provider": "Pinefield Medical",
    "policy_number": "POL-00000039",
    "coverage_level": "Standard",
    "annual_premium": 3164.99,
    "valid_from": "2024-09-05",
    "valid_until": "2025-09-05"
  },
  {
    "id": 40,
    "patient_id": 43,
    "provider": "Blue Harbour Cover",
    "policy_number": "POL-00000040",
    "coverage_level": "Basic",
    "annual_premium": 1649.95,
    "valid_from": "2024-03-26",
    "valid_until": "2025-03-26"
  },
  {
    "id": 41,
    "patient_id": 44,
    "provider": "Arcadia Health Plan",
    "policy_number": "POL-00000041",
    "coverage_level": "Basic",
    "annual_premium": 1236.32,